id,title,selftext,author,subreddit,score,num_comments,created_utc,url,upvote_ratio,over_18,edited,spoiler,stickied
1m57uz8,"Is this roster better than Houston, OKC, and Denver?","With the Goodwin waiver, it looks like this is the final roster until the season starts. The other 11 teams in the West either weren't particularly good or have gotten weaker, so I think the biggest threats in the West right now are OKC, Houston, and Denver. 

With Houston and Denver, I think LA is clearly better. As a first option, Luka is as good as Jokic and better than KD. LeBron is also better as a second option than Sengun or Murray. As for the role players in the starting lineup, Reaves/Ayton/Rui is a strong trio and I think they're better than Amen/FVV/Tari or Gordon/Cam/Braun. While our bench is pretty sparse, so is theirs so it's advantage Lakers.

With OKC specifically, they have a lot of young players who will have improved. I think OKC would still be favored against LA, but LA would have a solid (let's say 40%) shot to beat them in a series. Luka and LeBron are still a great duo, and we've shored up our biggest weaknesses and gotten Luka an actual center. 

I think this roster is a solid top 3 roster in the West, and while we might not be favorites we have a solid shot to win a ring. ",Timewalker102,lakers,0,120,2025-07-21 03:03:05,https://www.reddit.com/r/lakers/comments/1m57uz8/is_this_roster_better_than_houston_okc_and_denver/,0.34,False,False,False,False
1m5asl2,"I really like our depth now, but LeBron has to play a lesser role in regular season","For us to make a serious run in the playoff.

He is 41, he has to save his legs as much as possible.

Ideally he takes a back seat this season and just play 25 mins a game.

And leave the offensive duties to Luka and AR.

This is a young man game.

Lebron can only play at a high level in limited number of games. I prefer that to be in the playoff.

And LeBron last year number were deceiving.

But he had his worst +/-.

This is not a coincidence, he had much worst team before.

Basketball is game of inches and if LeBron pick his spot to play defense, it trickle down to the effectiveness of the whole team.  LeBron unable to play with full effort is very bad for our team.

I hope LeBron and JJ can realize this and have LeBron take a back seat in regular season, so he can save his legs for playoff.",Nonameheroz,lakers,0,37,2025-07-21 05:44:39,https://www.reddit.com/r/lakers/comments/1m5asl2/i_really_like_our_depth_now_but_lebron_has_to/,0.22,False,False,False,False
