id,title,selftext,author,subreddit,score,num_comments,created_utc,url,upvote_ratio,over_18,edited,spoiler,stickied
1m593wv,LeBron James & Anthony Davis in the 2020 finals,Still can’t believe LeBron was averaging 30/12/8 at 35 ,WayAdministrative679,lakers,1379,71,2025-07-21 04:08:39,https://i.redd.it/waw4xiypj5ef1.jpeg,0.98,False,False,False,False
1m56jh0,Thank you Mr. Hustle Goodwin,,neymarolga,lakers,1267,113,2025-07-21 01:57:39,https://i.redd.it/zedksfviw4ef1.jpeg,0.98,False,False,False,False
1m5q55d,Kobe Bryant’s highest scoring games,,WayAdministrative679,lakers,584,85,2025-07-21 18:02:32,https://i.redd.it/zf0580yko9ef1.jpeg,0.98,False,False,False,False
1m56mpw,"[Siegel] ‪The Lakers had talked with multiple teams over the last 24 hours to try and free up some money without sacrificing significant draft assets. Trade discussions never advanced past initial conversation, sources said. Goodwin is a player the Lakers liked.‬",,daftmunt,lakers,497,242,2025-07-21 02:01:53,https://i.redd.it/dsf1tz0ax4ef1.jpeg,0.99,False,False,False,False
1m5d8rq,the Lebron disrespect has gotten crazy,"Man, I get that Lebron's retirement is imminent, but the disrespect should stop. 

I haven't been a Laker fan since birth, but what I do know is that Lebron brought relevance, competitiveness, and a chip after the dark years. Sure, that was a couple of years back already.

But the man, even at 40, finished 6th in MVP voting, 2nd All-NBA team, and is still posting career-highs. 

Most of y'all are spoiled as hell. We got Luka now, sure. But whatever happened to the LA Lakers treats its stars well mantra they used to put out there to attract top FAs?

Arguably the GOAT, surely top 3, and as days have gone by, you see multiple posts and comments like:  
\- Trade LeBron (+Bronny even lmao)  
\- LeBron should step into a lesser role (he tried giving AD the keys)  
\- Yeah, he gave us a chip, but we're done with him, get him out

to think that some bums here are willing to trust Windhorst/Shelburne's stirred up drama over Lebron himself is crazy, don't you think?",macklawbltn,lakers,504,308,2025-07-21 08:17:57,https://www.reddit.com/r/lakers/comments/1m5d8rq/the_lebron_disrespect_has_gotten_crazy/,0.81,False,False,False,False
1m591l6,[Stein] The recent Dončić pitch particularly resonated with Smart and helped him choose the Lakers over a determined push by the Suns. Smart has been working hard on his body this summer. The Lakers were convinced during their pursuit that they will see a sleeker version of the 2021-22 DPOY.,"Soon to begin his (whoa) eighth NBA season, Dončić was a lead recruiter in the Lakers' pursuits of Deandre Ayton and Marcus Smart via the NBA's increasingly robust July buyout market.

I'm told that the recent Dončić pitch, once Washington granted the 31-year-old and his agent Jason Glushon permission to talk to other teams in search of a post-buyout landing spot, particularly resonated with Smart and helped lead the former Defensive Player of the Year to choose the Lakers over a determined push by the Suns to land the former Celtic.

I'm likewise told that Smart (like Dončić) has been working hard on his body this summer. Conditioning was an undeniable issue for Smart last season, but the Lakers were convinced during their pursuit that they will see a sleeker version of the 2021-22 DPOY.

I'm also hearing Jarred Vanderbilt is healthier now than he was at any point last season, which will naturally spark hope that the versatile forward seems like an offseason addition himself when training camp opens in late September. Ditto for Maxi Kleber, who made only one appearance — for five minutes in Game 5 of the Lakers' first-round exit to Minnesota — after he was shipped to Lakerland with Dončić on Feb. 2.

External fretting about Dončić committing his long-term future to the Lakers, meanwhile, has dissipated considerably thanks to the contributions made by the 26-year-old throughout free agency in collaboration with vice president of basketball operations Rob Pelinka. Contact between Pelinka, Dončić and two pillars of Team Luka — chief brand officer and business manager Lara Beth Seager and longtime agent Bill Duffy — has been constant since a well-chronicled dinner at Craig's in West Hollywood shortly after L.A.'s first-round playoff elimination that The Stein Line first reported on below in early May.",Odd-Direction9452,lakers,456,63,2025-07-21 04:05:14,https://open.substack.com/pub/marcstein/p/sunday-best-the-latest-hottest-and?r=1m9zg&utm_medium=ios,0.99,False,False,False,False
1m5qya7,"[Charania] The Los Angeles Lakers plan to sign 7-footer Christian Koloko and forward Chris Manon on two-way NBA contracts, sources tell ESPN. Manon, undrafted out of Vanderbilt, played for the Warriors in California and Las Vegas summer leagues. Koloko played 37 games for L.A. last season.",,Odd-Direction9452,lakers,478,119,2025-07-21 18:32:52,https://i.redd.it/who378y2u9ef1.jpeg,0.99,False,False,False,False
1m5uwsk,"[Siegel] The Lakers are waiving Trey Jemison III, who was on a two-way contract.",,daftmunt,lakers,351,73,2025-07-21 21:01:43,https://i.redd.it/l8509hwmkaef1.jpeg,0.99,False,False,False,False
1m5jjmt,"LeBron James appears in Tyler, The Creator’s music video for his new song “Stop Playing With Me.” Tyler, The Creator recently replaced his longtime funny profile picture of LeBron’s face with a new one that represents his latest album, “DON’T TAP THE GLASS.”",,LEMIROS_PIELAGO,lakers,241,35,2025-07-21 13:54:50,https://i.redd.it/h4yauc3hg8ef1.jpeg,0.95,False,False,False,False
1m59xx0,LEtatted,,angryshoper,lakers,184,24,2025-07-21 04:54:52,https://i.redd.it/8yr2ey45s5ef1.jpeg,0.94,False,False,False,False
1m5fhyg,"Okay player, tough cut, right move",Would I love him on the team? Yes. Would I waive him for Smart? Everyday and twice on Sunday. He's not trash — but he's not SGA either. Waiving him to make space for Marcus Smart is the right move.,puhtooti,lakers,185,51,2025-07-21 10:38:36,https://v.redd.it/afeavthgh7ef1,0.88,False,False,False,False
1m5s282,"[Johnson, NBC Sports] Warriors people loved having Chris Manon this summer. Was just talking with a source that is very high on him but said he has heard Manon's name pop up with other teams after his strong summer. Now, he's on a two-way with the Lakers. Looked like he could have been a hidden gem",,shreeharis,lakers,162,24,2025-07-21 19:14:12,https://i.redd.it/jugzixbg1aef1.jpeg,0.99,False,False,False,False
1m5mnx1,Marcus Smart’s arrival creates an epic chance for Reaves’ growth,,Savings_Entrance380,lakers,156,126,2025-07-21 15:54:43,https://lakeshowlife.com/marcus-smart-signing-could-unlock-version-of-austin-reaves-lakers-really-need/partners/47903,0.91,False,False,False,False
1m5rtup,[Woike] Word on Chris Manon is he’s a high-level defender and a smart player with a great motor who “plays the right way.” Value as a two-way signing in their developmental program.,,Odd-Direction9452,lakers,143,24,2025-07-21 19:05:32,https://i.redd.it/rd9d5cuwz9ef1.jpeg,0.99,False,False,False,False
1m5va1m,"[Siegel] Basically, unless we use the 2031 pick, basically no team wants to do a trade with LAL",,OkExchange7229,lakers,150,170,2025-07-21 21:15:42,https://i.redd.it/h545xst4naef1.jpeg,0.97,False,False,False,False
1m5habr,The Bench,"How do yall feel about Rob not addressing the bench(scoring wise)?  How do you think this issue will be dealt with?

Move Rui to Bench? 
Bank on Dalton to play better in the RG
",Gotsta_Win,lakers,121,111,2025-07-21 12:14:47,https://i.redd.it/qjpweekmy7ef1.jpeg,0.87,False,False,False,False
1m5qese,"[Siegel] There have also been zero recent trade conversations between the Suns and Lakers. 

The two teams have not talked since before Ayton signed with Los Angeles, as the team had previously expressed interest in Nick Richards.","The Lakers discussed Kentavious Caldwell-Pope and Donte DiVincenzo as potential trade targets with the Grizzlies and Timberwolves, sources told @ClutchPoints. 

KCP talks happened after he was included in the Bane-ORL trade. MIN immediately turned down DiVincenzo talks",WayAdministrative679,lakers,78,49,2025-07-21 18:12:44,https://i.redd.it/ibsjwdkeq9ef1.jpeg,1.0,False,False,False,False
1m5oz97,It's been almost 45 years since the Lakers last traded with the Portland Trail Blazers.,"From Basketball Reference: October 8, 1980: The Portland Trail Blazers traded Jim Brewer to the Los Angeles Lakers for a 1984 2nd round draft pick (Jerome Kersey was later selected). Portland had the option to swap 1st round draft picks with Los Angeles in 1984 but opted for a 2nd round draft pick instead.

Let's stop suggesting trades with the Portland Trail Blazers for Thybulle or Jrue. It seems they dislike the Lakers even more than the Celtics do.  
",Wise-Performance2420,lakers,63,17,2025-07-21 17:20:12,https://www.reddit.com/r/lakers/comments/1m5oz97/its_been_almost_45_years_since_the_lakers_last/,0.94,False,False,False,False
1m580cv,Let’s roll with this squad,"C - Ayton/Hayes

F - Lebron/Rui/LaRavia/Vando/Kleber/Adiou

G - Luka/Reaves/Vincent/Smart/Knecht/Bronny

I still believe we will make a move at the deadline but I’m honestly fine with the roster as is.  Yes we’d like another 3-D wing but let’s not discount internal growth and well designed scheme.  We filled two key needs going into the offseason: starting caliber center in Ayton, POA defender in Smart and we managed to not lose a wing by swapping DFS for LaRavia.  I’m hoping guys start working on their games starting now, seems like vacations are ending and guys will be back in the gym.  Vando needs a corner 3, LaRavia and Bronny and Reaves need to learn from Smart on how to be smarter defenders.  I like the team we have constructed, it’s not perfect but it’s better than last year’s team by virtue of simply having a starting center.  We have a Big 3 that each averaged 20+ ppg and 5+ APG in the second half of last season.

I’m not call us favorites (that’s OKC by default) but I think we are in the thick of it and can contend with the right scheme. 

Getting excited for October to roll around again.  We got a 3 seed with no true center for half the year and an out of shape Luka. Let’s see what we can do now. ",hplalakrs20012010,lakers,63,68,2025-07-21 03:10:41,https://www.reddit.com/r/lakers/comments/1m580cv/lets_roll_with_this_squad/,0.88,False,False,False,False
1m5qslo,"The clip that made me a Marcus Smart fan, talking about why he plays so hard","After seeing this clip and the longer podcast, where he talks about how losing his brother drove him to make the NBA, it was so clear where his motivation to play with all that heart and grit comes from and it made me view his game in a whole new light. 

Even when he was on the Celtics, you had to respect that he was playing harder than anyone else on the floor. To know why? Powerful stuff that makes him easy to root for. 

Another upside is that he could be crucial to Bronny’s development. He has slightly longer measurements, but they have very similar physicals as strong/short guards in height/weight/wingspan. He can teach Bronny a lot about how to be effective with that build. ",tizzy713,lakers,54,4,2025-07-21 18:26:57,https://youtube.com/shorts/pek-qU9pmSg?si=P3PdIQA32bIUJKEc,0.97,False,False,False,False
1m57t90,Is there a way to get Goodwin back?,I know Goodwin isn’t Michael Jordan or whatever but he’s a good energy third stringer. What if we let’s say spent the next few weeks looking for a team to shed salary with via trade and ensured Goodwin that we would sign him for a vet minimum after. Is this possible or even legal?,ProfessionalCat2770,lakers,48,49,2025-07-21 03:00:43,https://www.reddit.com/r/lakers/comments/1m57t90/is_there_a_way_to_get_goodwin_back/,0.84,False,False,False,False
1m588nk,Do you think Kobe shouldve won the 2009 MVP?,"Idk why but ive always thought Kobe shouldve won MVP in 2009. He led a 65 win team in a tougher western conference, he was finally a leader, and still averaged your regular Kobe stats. 

I would like to hear your opinions.",CommunityFirm7764,lakers,38,122,2025-07-21 03:22:44,https://www.reddit.com/r/lakers/comments/1m588nk/do_you_think_kobe_shouldve_won_the_2009_mvp/,0.7,False,False,False,False
1m5s1qg,Chris Manon On Ball Defense Film,,Important_Square_535,lakers,35,11,2025-07-21 19:13:39,https://youtube.com/watch?v=seCQSqBo1dw&si=9mj-lL-UVKORBJ8F,0.97,False,False,False,False
1m5rl72,Chris Manon 2024-25 NCAA Vanderbilt highlights,"We just signed him on a Two-Way contract, I really like the highlights ",WayAdministrative679,lakers,24,9,2025-07-21 18:56:37,https://youtu.be/fTLchGYdnpw,1.0,False,False,False,False
1m5jq47,Daily Lakers Offseason Discussion Thread,Lakers season is over. Talk about whatever you want.,AutoModerator,lakers,12,225,2025-07-21 14:01:54,https://www.reddit.com/r/lakers/comments/1m5jq47/daily_lakers_offseason_discussion_thread/,0.94,False,False,False,True
1m5td5b,Who are our 3 2-way players as it stands right now?,"In light of the recent developments regarding Chris Manon & Koloko, does this mean that Trey Jemison is no longer on a 2 way deal, or that Eric Dixon was never signed to one? 

I haven’t seen any news regarding Dixon at all other than that he was injured and wouldn’t be playing in summer league. But I thought he was still on a 2 way with LA? I’d give him the 3rd 2 way over Jemison, he looked pedestrian in summer league. Koloko outplayed him big time. 

*UPDATE* Jemsion got waived according to multiple reports, the 3rd 2 way spot is open now ",FleetwoodMackin,lakers,11,9,2025-07-21 20:03:24,https://www.reddit.com/r/lakers/comments/1m5td5b/who_are_our_3_2way_players_as_it_stands_right_now/,0.87,False,1753133074.0,False,False
1m5llag,"G League, Two-way and Exhibit 10 rules","After reading a lot of posts many are confused about how these rules work for players and teams. Here are the basics on each of these.

The rules for G League players primarily revolve around their status with NBA teams, including standard contract players, two-way players, and assignment players, with G League teams also having their own roster and player eligibility rules. G League players are eligible for various types of contracts, including the ability to sign with NBA parent clubs. 
Players under standard G League contracts are essentially free agents and can be signed by any NBA team. However, two-way players are under contract with a specific NBA team and can only be signed by that team. Additionally, players on assignment from an NBA team to the G League are still under contract with that NBA team and can be recalled at any time. 

G League Standard NBA Contract Players:

NBA teams can assign players with less than three years of NBA service to their G League affiliate, who remain on the NBA roster and can be recalled at any time. Players with more service time may also use the G League for injury rehabilitation. 
NBA teams can retain up to four players they waive from their training camp rosters, designating them as ""affiliate players"" who are then automatically allocated to that team's G League affiliate if they sign a G League contract. 
So basically out of 13 spots on a G League team the parent club can basically protect 7 players from other teams trying to poach them.

Two-Way players

Eligibility:
Two-way contracts are for players with three or fewer years of NBA service.
Each NBA team can have up to three players on two-way contracts. 
Playing Time:
Players on two-way contracts can spend up to 50 games with their NBA team during the regular season. 
They spend the rest of the season with their G League affiliate. 
Compensation:
Two-way contracts pay a pro-rated portion of the rookie minimum salary (half the value for 2025-26). 
The contracts can be partially guaranteed, with a portion of the salary guaranteed if the player isn't waived before the start of the regular season. 
Players can also have their contracts converted to standard NBA deals, with the salary becoming the NBA minimum for their years of service. 
Postseason:
Two-way players are generally not eligible for the NBA playoffs. 
However, they can become eligible if their contract is converted to a standard NBA deal before the start of the playoffs. 
Other Notable Points:
Two-way contracts do not count against the salary cap for the NBA team. 
The NBA introduced two-way contracts in the 2017 offseason to help teams develop young players. 
Teams can offer these contracts to players who have not yet accumulated significant NBA experience. 

Exhibit 10 contracts

Minimum Salary: Exhibit 10 contracts are typically for the league minimum salary. 
Non-Guaranteed: These contracts are not guaranteed, meaning a team can waive a player without financial penalty before the regular season begins. 
Training Camp Invite: Exhibit 10 contracts are a common way for teams to bring players to training camp to compete for a roster spot. 
Conversion to Two-Way Contract: The contract can be converted to a two-way contract (allowing the player to play for both the NBA team and its G League affiliate) before the start of the regular season. 
Exhibit 10 Bonus: If the player is waived and then signs with the team's G League affiliate, they can earn a bonus (typically between $5,000 and $50,000). 
G League Affiliate: The bonus incentivizes the player to sign with the team's G League affiliate, allowing the team to retain their rights and develop them. 
Limited to Six: Teams can have a maximum of six Exhibit 10 contracts at any given time. 

Kind of a lot to sift through but gives the basics on each. Another thing to think about is any player that signs a standard G League contract as a free agent with any G league team is free to sign with any NBA team at any time. They are basically free agents playing in the G League.",Large_Leading_4985,lakers,8,4,2025-07-21 15:14:27,https://www.reddit.com/r/lakers/comments/1m5llag/g_league_twoway_and_exhibit_10_rules/,0.73,False,False,False,False
1m5sitv,Rui’s Future (2027 plan),"I know this is looking a little bit into the future but where does rui stand with the so called 2027 off season plan? I would love to keep rui on the team but do we really see him taking a 1 year deal to stay on the lakers next off season? I say this because there is just enough cap space to sign a max (35%) free agent with the current salaries on the books in 2027-2028 plus Luka and Austin. I’m not exactly sure what the off season plan in that year would be but it doesn’t make sense for the lakers to not have that cap space open given how much has come out about the 2027 off season. Do you guys think that they commit to Rui and lose some flexibility in 2027 or trade/lose him in FA. This isn’t even accounting for if Deandre resigns which makes the situation even tighter. I haven’t really seen much discourse around Rui in the context of the 2027 off season so please correct me if I’m wrong or if there are other options to keep him!

TL;DR: Ruis next contract would prevent some of the flexibility they’ve been focusing on for 2027, will they try to keep flexibility/trade him or commit to him and lose out on the 35% cap slot that they will barely have when Luka and Austin resign.
",That-Steak7081,lakers,10,33,2025-07-21 19:31:25,https://www.reddit.com/r/lakers/comments/1m5sitv/ruis_future_2027_plan/,0.81,False,False,False,False
1m5w9xj,"Lakers Notes: Doncic, Smart, Vanderbilt, Kleber, More",,No-Description-2138,lakers,4,3,2025-07-21 21:55:12,https://www.hoopsrumors.com/2025/07/lakers-notes-doncic-smart-vanderbilt-kleber-more.html,0.84,False,False,False,False
1m5v07a,Kobe’s Film Study Obsession: Seeing What Others Missed,,Spirited-Gold9629,lakers,6,0,2025-07-21 21:05:17,https://sportsorca.com/nba/kobe-bryant-film-study-obsession/,0.75,False,False,False,False
1m5nsil,"If 2 of Knecht, Vando, Kleber become rotation pieces - we can compete","Out top 7 is pretty nailed down at this point sans a Rui trade. That is, they are getting minutes regardless. The 8/9 slots though seem wide open. 

To me Gabe and Hayes are well Gabe and Hayes. Not terrible but the definition of mid/meh. What we see is what we get. They'll be ok sometimes and mediocre the next. It is clear Gabe was just on fire that one year and he is what he is. Same w Hayes. 

Vando, Kleber and Knecht though - there could be some upside. Maybe Vando has just been hurt all this time. Maybe Kleber will bounce back. Maybe Knecht grows. If just two of these guys can solidify the backup spots I think we are a top 3 seed in the west. ",the_dave_pool,lakers,6,70,2025-07-21 16:37:06,https://www.reddit.com/r/lakers/comments/1m5nsil/if_2_of_knecht_vando_kleber_become_rotation/,0.57,False,False,False,False
1m5wgmx,Who would you trade for based on the scenario?,"Who are some 2 way wings that can realistically be traded for without giving up much to add more depth to the roster either on an expiring contract or for a longterm fit?

If the Lakers are a top 3 seed nearing the trade deadline would you want them to get more aggressive about winning this season and if so which player would you want to trade for and what would you be okay with giving up for them?",The_Grim_Adventurer,lakers,3,31,2025-07-21 22:02:32,https://www.reddit.com/r/lakers/comments/1m5wgmx/who_would_you_trade_for_based_on_the_scenario/,1.0,False,False,False,False
1m5xxhp,Realistic (imo) trade proposal: (BRK) Tyrese Martin for (LAL) Gabe Vincent+2032 second round pick.,"Think this is a realistic trade involving the Nets and Lakers with the Nets taking on Vincent, who would give Brooklyn a veteran ballhander, which they lack, and take on a potentially strong second round pick. Lakers clear $9-11M.

The Brett Seigel article re: the Lakers desire to keep Goodwin mentioned teams putting the squeeze on the Lakers knowing their straits in wanting to keep Goodwin but lacking flexibility. However I do think this is a deal the Nets would accept with a pick attached. Lakers would have a lot of flexibility in-season to make roster changes with this trade and Martin is a non-guaranteed minimum salary...his contract would have to be guaranteed for the trade but he likely gets immediately bought out. 

This is the kind of deal I think is realistic for the Lakers involving an expiring of theirs. You'd have space to make two additions to the roster from there or keep the final spot open if they so choose. Seigel's piece does lend credence to the fact they are looking to move off the expirings....this is a way to do so I believe. You're not realistically gonna get anything good for someone like Vincent but there is a way to clear his money.",RVALover4Life,lakers,0,27,2025-07-21 23:03:04,https://www.reddit.com/r/lakers/comments/1m5xxhp/realistic_imo_trade_proposal_brk_tyrese_martin/,0.36,False,False,False,False
1m5chap,Grade the offseason poll,"Grade/discuss offseason that is almost certainly finished for the lakers. 

I think we can safely assume they are holding and re-assessing at the deadline from here on out. 

I’m personally excited at the least because we have two new starters, and it’s just gonna be a totally different look. When’s the last time we’ve had that?


[View Poll](https://www.reddit.com/poll/1m5chap)",IllustriousRead2146,lakers,0,35,2025-07-21 07:29:13,https://www.reddit.com/r/lakers/comments/1m5chap/grade_the_offseason_poll/,0.5,False,1753083361.0,False,False
1m5xcwy,What is your opinion on this,,The_real_bandito,lakers,5,90,2025-07-21 22:39:17,https://i.redd.it/8nyupjo12bef1.jpeg,0.53,False,False,False,False
1m5dfnh,TMAC Career vs. Kobe post Shaq comparison request.,"BBallref used to have very detailed search options pre-paywall, but they kind of suck now, and with the current noise TMac has been generating, I've been wondering what the comparisons look like excluding the Kobe Shaq years. I know it's easy to say, well, 2 rings and 3 finals against a very tough western conference that included TMac, but what gives TMac the current nod he seems to be getting? Or at least, what are the stats that can lead someone to an opinion either way?",ablackcloudupahead,lakers,0,19,2025-07-21 08:30:09,https://www.reddit.com/r/lakers/comments/1m5dfnh/tmac_career_vs_kobe_post_shaq_comparison_request/,0.4,False,False,False,False
1m5myt0,“License and Registration”: Shaquille O’Neal Impersonated a Cop and Pulled Over Lakers Teammate for Speeding,,boomer9745,lakers,0,14,2025-07-21 16:05:57,https://thesportsrush.com/nba-news-license-and-registration-shaquille-oneal-impersonated-a-cop-and-pulled-over-teammate-for-speeding/,0.33,False,False,False,False
