post_id,title,selftext,author,score,num_comments,upvote_ratio,created_utc,subreddit,vader_compound,vader_positive,vader_negative,vader_neutral,transformer_positive,transformer_negative,transformer_neutral,transformer_sentiment,analysis_timestamp,vader_classification,agreement
1o1drvz,By Creative Director Natalia Bryant 💜💛🐍,,MamiTarantina,944,54,0.98,2025-10-08 15:31:43,lakers,0.7003,0.42,0.0,0.58,0.0977330431342125,0.021759813651442528,0.880507230758667,neutral,2025-10-08 18:14:57.395734,positive,disagree
1o1idr4,my heart 🥹,,creamyglazed,759,35,0.99,2025-10-08 18:19:06,lakers,0.8555,0.808,0.0,0.192,0.591608464717865,0.0662667378783226,0.3421248495578766,positive,2025-10-08 18:14:57.433267,positive,all_agree
1o1gy0k,Natalia Bryant X Brenda Song behind the scenes,,MamiTarantina,597,17,0.99,2025-10-08 17:27:11,lakers,0.0,0.0,0.0,1.0,0.040366772562265396,0.012654131278395653,0.9469791054725647,neutral,2025-10-08 18:14:57.485864,neutral,all_agree
1o11er4,"Luka's new IG post - ""🧩""",,Kang_Burger,569,34,0.99,2025-10-08 04:51:30,lakers,0.0,0.0,0.0,1.0,0.1084211990237236,0.012809920124709606,0.8787688612937927,neutral,2025-10-08 18:14:57.528423,neutral,all_agree
1o1niml,"Ayton was asked what it's been like working with Luka and LeBron: ""I haven't. It's something I've just been waiting on.""",,WittyKittieKat,407,168,0.99,2025-10-08 21:12:18,lakers,0.6124,0.111,0.0,0.889,0.09425150603055954,0.07238292694091797,0.8333655595779419,neutral,2025-10-08 18:14:57.599479,positive,disagree
1o0wsaw,[Lakers] Building together.,,OfficialPaddysPub,195,7,1.0,2025-10-08 00:58:40,lakers,0.0,0.0,0.0,1.0,0.6832765340805054,0.009048905223608017,0.3076745569705963,positive,2025-10-08 18:14:57.643025,neutral,disagree
1o1k93c,Kobe!,,Doten1,169,6,0.98,2025-10-08 19:23:18,lakers,0.0,0.0,0.0,1.0,0.7002672553062439,0.021840771660208702,0.27789199352264404,positive,2025-10-08 18:14:57.687102,neutral,disagree
1o1o4st,Ayton on Bron n Luka Playtime,,MamiTarantina,92,43,0.96,2025-10-08 21:37:10,lakers,0.0,0.0,0.0,1.0,0.07692233473062515,0.016278354451060295,0.90679931640625,neutral,2025-10-08 18:14:57.732631,neutral,all_agree
1o1ff6d,From Rivals to Teammates,"Full video https://youtu.be/KRR37-lHd0s?si=58SLazCr2oA4WxRC Bitchass Book fouls AR, then Bitchass Ayton stands over AR acting tough (rrrrrbody act tough when they’re up) gets shoved out by dawg Pat Bev FUCK THR BUMS",MamiTarantina,84,13,0.95,2025-10-08 16:31:34,lakers,0.0,0.0,0.0,1.0,0.06486335396766663,0.04391805827617645,0.8912186622619629,neutral,2025-10-08 18:14:57.772695,neutral,all_agree
1o1e9tu,[Highlight] Two-Man Game Between LeBron and Nash,"@mindthegamepod Imagine the two-man game between @kingjames and @stevenash?

The duo break down how alphas play together and preview this year's Lakers squad on a brand new episode. Watch on our YouTube, @primevideo or listen wherever you get your podcasts.",MamiTarantina,56,19,0.94,2025-10-08 15:49:49,lakers,0.5859,0.286,0.0,0.714,0.2806694507598877,0.008875256404280663,0.7104553580284119,neutral,2025-10-08 18:14:57.821216,positive,disagree
1o1j1ob,LePlayoff Monster,"Doesn’t look like LeBron’s playoff record could ever be broken.

https://sportscondensed.com/news/le-bron-james-playoffs-success-is-unmatched
—via Sports Condensed",boomer9745,55,28,0.87,2025-10-08 18:39:09,lakers,0.0,0.0,0.0,1.0,0.08901142328977585,0.23346953094005585,0.6775190234184265,neutral,2025-10-08 18:14:57.862233,neutral,all_agree
1o1hu46,[Woike] Latest on Knecht,,OkExchange7229,53,122,0.78,2025-10-08 17:59:32,lakers,0.0,0.0,0.0,1.0,0.0947931706905365,0.020034411922097206,0.885172426700592,neutral,2025-10-08 18:14:57.907009,neutral,all_agree
1o1dlye,13 DAYS TO START THE REGULAR SEASON! HERE’S  #13 WILT CHAMBERLAIN 13 TIMES. 💜💛,,MamiTarantina,44,2,0.96,2025-10-08 15:25:45,lakers,0.0,0.0,0.0,1.0,0.20477652549743652,0.004267918411642313,0.7909555435180664,neutral,2025-10-08 18:14:57.961550,neutral,all_agree
1o0ya0u,"🍆, right?","Hachimura said he texted James to get the information straight from the source, and James responded with an emoji -- but Hachimura wouldn't share which emoji.",PlopMcGoo,18,17,0.74,2025-10-08 02:09:05,lakers,0.0,0.0,0.0,1.0,0.18512530624866486,0.06791966408491135,0.7469550967216492,neutral,2025-10-08 18:14:58.007611,neutral,all_agree
1o1rg28,"[Buha] The Lakers have added an arc inside the 3-point line, perhaps to symbolize the mid-range/long 2 attempts the Lakers want to avoid",,MullingHollysDrive,12,11,0.93,2025-10-09 00:02:45,lakers,-0.4215,0.053,0.09,0.857,0.04273812100291252,0.08814254403114319,0.8691193461418152,neutral,2025-10-08 18:14:58.080894,negative,disagree
1o1bb6s,Daily Lakers Offseason Discussion Thread,Lakers season is over. Talk about whatever you want.,AutoModerator,5,21,1.0,2025-10-08 14:00:51,lakers,0.0,0.0,0.0,1.0,0.04344440996646881,0.04053746908903122,0.9160181283950806,neutral,2025-10-08 18:14:58.124428,neutral,all_agree
1o12i2d,Kobe and Gianna Bryant mural removed from Dana Point business,,MeGustoCrudo,2,3,0.67,2025-10-08 05:56:27,lakers,0.0,0.0,0.0,1.0,0.022151149809360504,0.19804523885250092,0.7798036336898804,neutral,2025-10-08 18:14:58.179503,neutral,all_agree
1o1e80q,Do you think JJ Redick will put Jarred Vanderbilt into the starting lineup?,"With Jarred Vanderbilt being healthy again, he’s looked like himself again during the preseason and he did solid offensively as well and I hope that JJ Redick could put him back into the starting lineup like the 2022-23 season with this lineup:

Luka, AR, Lebron, Vando, and Ayton",CallTypical9541,1,51,0.53,2025-10-08 15:47:59,lakers,0.5204,0.154,0.0,0.846,0.026605673134326935,0.008580924943089485,0.9648134112358093,neutral,2025-10-08 18:14:58.238631,positive,disagree
1o0xmzn,Does the value of Rui Hachimura's shooting offset his defensive clumsiness and clunkiness with the way this team is constructed?,"I'm asking this because....for one, yes, I'm going to continue to ring the bell on Marcus Smart being a starter and to me, that should be even more clear now than it was a week ago. Some of the issues the Lakers have defensively basically are not salvageable unless Smart starts. He's the one player who could potentially salvage those issues with his size/ability as a POA defender and versatility.

But I am also asking this because as hard as Rui tries, and he is a good defender against forwards his size. He defends bigger forwards well. But he struggles with defensive awareness and he isn't the best when he's being forced to defend down the lineup. That hasn't changed and likely never will. He's become a passable overall defender, but his weaknesses defensively are magnified with this group, which is in part why the Lakers were a pretty damn bad defensive group last year with he and AR/Bron/Luka on the floor together.

Yeah, the offense could make up for it, but is that a championship winning collective? Does Smart really bog down the offense that much? I don't think he does.

But this isn't a Marcus Smart post specifically. It's a Rui one, and it isn't a bashing post, but I do wanna know whether you all think what Rui does offer this ballclub as a starter, particularly, offsets his blase defense. What do you think Rui's value is to this team with how it is currently constructed.",RVALover4Life,0,29,0.45,2025-10-08 01:38:29,lakers,0.6553,0.17,0.0,0.83,0.04153439775109291,0.150309219956398,0.8081563711166382,neutral,2025-10-08 18:14:58.308668,positive,disagree
